{
  "$schema": "../../schema/_output/models/meta.json",
  "id": "o1-preview",
  "name": "o1 preview",
  "creators": [
    "OpenAI"
  ],
  "published_at": {
    "value": "2024-09-12",
    "references": []
  },
  "states": {
    "2024-09-12": [
      "EXPERIMENTAL"
    ]
  },
  "cutoff_date": {
    "value": "2023-10",
    "references": []
  },
  "token_limit": {
    "input": 128000,
    "output": 32768,
    "references": []
  },
  "identifiers": {
    "lmarena": "o1-preview"
  },
  "license": {
    "value": "Proprietary",
    "references": []
  },
  "multimodalities": {
    "input": [
      "text"
    ],
    "output": [
      "text"
    ],
    "references": []
  },
  "features": {
    "value": [],
    "references": []
  }
}