{
  "$schema": "../../schema/_output/models/meta.json",
  "id": "grok-3",
  "name": "Grok 3",
  "creators": [
    "xAI"
  ],
  "published_at": {
    "value": "2025-02-17",
    "references": []
  },
  "states": {
    "2025-02-17": [
      "EXPERIMENTAL"
    ]
  },
  "cutoff_date": {
    "value": "2024-10-31",
    "references": [
      {
        "url": "https://www.reddit.com/r/grok/comments/1iubkvu/grok_3s_actual_knowledge_cutoff_date_is_october/",
        "retrieved": "2025-03-27T06:46:32.098Z"
      }
    ]
  },
  "token_limit": {
    "input": 1000000,
    "output": null,
    "references": [
      {
        "url": "https://x.ai/news/grok-3",
        "retrieved": "2025-03-27T06:55:32.158Z"
      }
    ]
  },
  "identifiers": {
    "lmarena": "early-grok-3"
  },
  "logos": [
    "grok-icon-2025/image.svg"
  ],
  "license": {
    "value": "Proprietary",
    "references": []
  },
  "multimodalities": {
    "input": [
      "text"
    ],
    "output": [
      "text"
    ],
    "references": []
  },
  "features": {
    "value": [
      "REASONING"
    ],
    "references": []
  }
}