{
  "$schema": "../../schema/_output/models/meta.json",
  "id": "gemini-1.5-flash-8b-001",
  "name": "gemini-1.5-flash-8b-001",
  "creators": [
    "Google"
  ],
  "published_at": {
    "value": "2024-10-23",
    "references": []
  },
  "states": {
    "2024-10-23": [
      "STABLE"
    ]
  },
  "identifiers": {
    "lmarena": "gemini-1.5-flash-8b-001"
  },
  "logos": [
    "google-gemini-icon/image.svg"
  ],
  "token_limit": {
    "input": 1048576,
    "output": 8192,
    "references": []
  },
  "multimodalities": {
    "input": [
      "text",
      "image",
      "audio",
      "video"
    ],
    "output": [
      "text"
    ],
    "references": []
  },
  "license": {
    "value": "Proprietary",
    "references": []
  },
  "cutoff_date": {
    "value": "2024-10",
    "references": []
  },
  "features": {
    "value": ["FUNCTION_CALLING"],
    "references": []
  },
  "model_parameters": {
    "value": 80000000000,
    "trustability": "GUESSED",
    "references": []
  }
}