{
  "$schema": "../../schema/_output/models/meta.json",
  "id": "gpt-4-0613",
  "name": "GPT-4 0613",
  "creators": [
    "OpenAI"
  ],
  "published_at": {
    "value": "2023-06-13",
    "references": []
  },
  "states": {
    "2023-06-13": [
      "STABLE"
    ]
  },
  "cutoff_date": {
    "value": "2023-12-01",
    "references": [
      {
        "url": "https://platform.openai.com/docs/models/gpt-4",
        "retrieved": "2025-03-27T06:46:32.062Z"
      }
    ]
  },
  "token_limit": {
    "input": 8192,
    "output": 8192,
    "references": []
  },
  "identifiers": {
    "lmarena": "gpt-4-0613"
  },
  "license": {
    "value": "Proprietary",
    "references": []
  },
  "multimodalities": {
    "input": [
      "text"
    ],
    "output": [
      "text"
    ],
    "references": []
  },
  "features": {
    "value": [],
    "references": []
  }
}