{
  "$schema": "../../schema/_output/models/meta.json",
  "id": "deepseek-r1",
  "name": "DeepSeek R1",
  "creators": [
    "DeepSeek"
  ],
  "published_at": {
    "value": "2025-01-20",
    "references": []
  },
  "states": {
    "2025-01-20": [
      "STABLE"
    ]
  },
  "identifiers": {
    "lmarena": "deepseek-r1"
  },
  "logos": ["deepseek-icon/image.svg"],
  "license": {
    "value": "MIT",
    "references": []
  },
  "links": {
    "huggingface": "https://huggingface.co/deepseek-ai/DeepSeek-R1"
  },
  "multimodalities": {
    "input": [
      "text"
    ],
    "output": [
      "text"
    ],
    "references": []
  },
  "cutoff_date": {
    "value": "2024-10",
    "references": []
  },
  "token_limit": {
    "input": 128000,
    "output": null,
    "references": []
  },
  "features": {
    "value": ["REASONING"],
    "references": []
  }
}
