{
  "$schema": "../../schema/_output/models/meta.json",
  "id": "claude-3-opus-20240229",
  "name": "claude-3-opus-20240229",
  "creators": [
    "Anthropic"
  ],
  "published_at": {
    "value": "2024-02-29",
    "references": []
  },
  "states": {
    "2024-02-29": [
      "STABLE"
    ]
  },
  "identifiers": {
    "lmarena": "claude-3-opus-20240229"
  },
  "license": {
    "value": "Proprietary",
    "references": []
  },
  "multimodalities": {
    "input": [
      "text",
      "image"
    ],
    "output": [
      "text"
    ],
    "references": []
  },
  "cutoff_date": {
    "value": "2023-08",
    "references": []
  },
  "token_limit": {
    "input": 200000,
    "output": 4096,
    "references": []
  },
  "features": {
    "value": [],
    "references": []
  }
}